{
  "formationUsage": [
    {
      "formation": "5-3-2",
      "matches": 2,
      "share": 50.0
    },
    {
      "formation": "4-1-4-1",
      "matches": 1,
      "share": 25.0
    },
    {
      "formation": "4-4-2",
      "matches": 1,
      "share": 25.0
    }
  ],
  "group": "k",
  "matches": [
    {
      "date": "2026-06-17",
      "distanceCovered": 112.4,
      "expectedGoals": 0.54,
      "formation": "5-3-2",
      "goalsAgainst": 1,
      "goalsFor": 1,
      "isHome": false,
      "matchId": "m023-portugal-congo-dr",
      "opponent": {
        "id": "portugal",
        "name": "Portugal"
      },
      "passCompletion": 80.0,
      "possession": 25.3,
      "result": "draw",
      "shots": 8,
      "shotsOnTarget": 2,
      "stage": "group"
    },
    {
      "date": "2026-06-23",
      "distanceCovered": 106.0,
      "expectedGoals": 0.42,
      "formation": "5-3-2",
      "goalsAgainst": 1,
      "goalsFor": 0,
      "isHome": false,
      "matchId": "m048-colombia-congo-dr",
      "opponent": {
        "id": "colombia",
        "name": "Colombia"
      },
      "passCompletion": 75.0,
      "possession": 32.9,
      "result": "loss",
      "shots": 7,
      "shotsOnTarget": 1,
      "stage": "group"
    },
    {
      "date": "2026-06-27",
      "distanceCovered": 115.1,
      "expectedGoals": 2.11,
      "formation": "4-4-2",
      "goalsAgainst": 1,
      "goalsFor": 3,
      "isHome": true,
      "matchId": "m072-congo-dr-uzbekistan",
      "opponent": {
        "id": "uzbekistan",
        "name": "Uzbekistan"
      },
      "passCompletion": 85.0,
      "possession": 53.0,
      "result": "win",
      "shots": 19,
      "shotsOnTarget": 5,
      "stage": "group"
    },
    {
      "date": "2026-07-01",
      "distanceCovered": 114.0,
      "expectedGoals": 0.64,
      "formation": "4-1-4-1",
      "goalsAgainst": 2,
      "goalsFor": 1,
      "isHome": false,
      "matchId": "m080-england-congo-dr",
      "opponent": {
        "id": "england",
        "name": "England"
      },
      "passCompletion": 83.0,
      "possession": 37.9,
      "result": "loss",
      "shots": 7,
      "shotsOnTarget": 2,
      "stage": "r32"
    }
  ],
  "name": "Congo DR",
  "record": {
    "drawn": 1,
    "furthestStage": "r32",
    "goalDifference": 0,
    "goalsAgainst": 5,
    "goalsFor": 5,
    "lost": 2,
    "played": 4,
    "points": 4,
    "won": 1
  },
  "schemaVersion": 4,
  "tacticalIdentity": {
    "defensiveBlockDistribution": {
      "high": 3.5,
      "low": 30.2,
      "mid": 22.0
    },
    "phasesInPossession": {
      "attackingTransition": 16.5,
      "buildUpOpposed": 12.0,
      "buildUpUnopposed": 26.2,
      "counterAttack": 2.2,
      "finalThird": 14.0,
      "longBall": 5.8,
      "progression": 19.2,
      "setPiece": 8.0
    },
    "phasesOutOfPossession": {
      "counterPress": 8.5,
      "defensiveTransition": 11.8,
      "highBlock": 3.5,
      "highPress": 3.2,
      "lowBlock": 30.2,
      "lowPress": 0.2,
      "midBlock": 22.0,
      "midPress": 3.0,
      "recovery": 4.5
    },
    "possession": 37.3,
    "pressingIntensity": 308.5,
    "shapeByPhase": {
      "inPossession": {
        "buildUpLow": {
          "lineHeight": 18.0,
          "teamLength": 39.5,
          "teamWidth": 54.5
        },
        "buildUpMid": {
          "lineHeight": 41.2,
          "teamLength": 31.5,
          "teamWidth": 54.0
        },
        "finalThirdPhase": {
          "lineHeight": 55.8,
          "teamLength": 34.8,
          "teamWidth": 44.2
        }
      },
      "outOfPossession": {
        "highBlockPress": {
          "lineHeight": 49.0,
          "teamLength": 35.8,
          "teamWidth": 40.5
        },
        "lowBlock": {
          "lineHeight": 19.2,
          "teamLength": 24.0,
          "teamWidth": 35.2
        },
        "midBlock": {
          "lineHeight": 38.8,
          "teamLength": 25.8,
          "teamWidth": 39.2
        }
      }
    }
  },
  "teamCode": "cod",
  "teamId": "congo-dr"
}
