{
  "formationUsage": [
    {
      "formation": "4-2-3-1",
      "matches": 5,
      "share": 100.0
    }
  ],
  "group": "k",
  "matches": [
    {
      "date": "2026-06-17",
      "distanceCovered": 109.8,
      "expectedGoals": 0.57,
      "formation": "4-2-3-1",
      "goalsAgainst": 1,
      "goalsFor": 1,
      "isHome": true,
      "matchId": "m023-portugal-congo-dr",
      "opponent": {
        "id": "congo-dr",
        "name": "Congo DR"
      },
      "passCompletion": 92.0,
      "possession": 68.9,
      "result": "draw",
      "shots": 7,
      "shotsOnTarget": 1,
      "stage": "group"
    },
    {
      "date": "2026-06-23",
      "distanceCovered": 110.2,
      "expectedGoals": 2.03,
      "formation": "4-2-3-1",
      "goalsAgainst": 0,
      "goalsFor": 5,
      "isHome": true,
      "matchId": "m047-portugal-uzbekistan",
      "opponent": {
        "id": "uzbekistan",
        "name": "Uzbekistan"
      },
      "passCompletion": 90.0,
      "possession": 56.1,
      "result": "win",
      "shots": 17,
      "shotsOnTarget": 9,
      "stage": "group"
    },
    {
      "date": "2026-06-27",
      "distanceCovered": 104.0,
      "expectedGoals": 0.97,
      "formation": "4-2-3-1",
      "goalsAgainst": 0,
      "goalsFor": 0,
      "isHome": false,
      "matchId": "m071-colombia-portugal",
      "opponent": {
        "id": "colombia",
        "name": "Colombia"
      },
      "passCompletion": 92.0,
      "possession": 41.4,
      "result": "draw",
      "shots": 13,
      "shotsOnTarget": 2,
      "stage": "group"
    },
    {
      "date": "2026-07-02",
      "distanceCovered": 116.6,
      "expectedGoals": 1.91,
      "formation": "4-2-3-1",
      "goalsAgainst": 1,
      "goalsFor": 2,
      "isHome": true,
      "matchId": "m083-portugal-croatia",
      "opponent": {
        "id": "croatia",
        "name": "Croatia"
      },
      "passCompletion": 91.0,
      "possession": 55.3,
      "result": "win",
      "shots": 15,
      "shotsOnTarget": 3,
      "stage": "r32"
    },
    {
      "date": "2026-07-06",
      "distanceCovered": 112.8,
      "expectedGoals": 0.91,
      "formation": "4-2-3-1",
      "goalsAgainst": 1,
      "goalsFor": 0,
      "isHome": true,
      "matchId": "m093-portugal-spain",
      "opponent": {
        "id": "spain",
        "name": "Spain"
      },
      "passCompletion": 82.0,
      "possession": 41.7,
      "result": "loss",
      "shots": 10,
      "shotsOnTarget": 2,
      "stage": "r16"
    }
  ],
  "name": "Portugal",
  "record": {
    "drawn": 2,
    "furthestStage": "r16",
    "goalDifference": 5,
    "goalsAgainst": 3,
    "goalsFor": 8,
    "lost": 1,
    "played": 5,
    "points": 5,
    "won": 2
  },
  "schemaVersion": 4,
  "tacticalIdentity": {
    "defensiveBlockDistribution": {
      "high": 7.4,
      "low": 19.2,
      "mid": 18.2
    },
    "phasesInPossession": {
      "attackingTransition": 9.6,
      "buildUpOpposed": 19.0,
      "buildUpUnopposed": 37.8,
      "counterAttack": 1.2,
      "finalThird": 18.0,
      "longBall": 1.8,
      "progression": 18.0,
      "setPiece": 5.0
    },
    "phasesOutOfPossession": {
      "counterPress": 10.4,
      "defensiveTransition": 14.8,
      "highBlock": 7.4,
      "highPress": 5.0,
      "lowBlock": 19.2,
      "lowPress": 0.2,
      "midBlock": 18.2,
      "midPress": 4.8,
      "recovery": 4.4
    },
    "possession": 52.7,
    "pressingIntensity": 256.4,
    "shapeByPhase": {
      "inPossession": {
        "buildUpLow": {
          "lineHeight": 18.2,
          "teamLength": 40.4,
          "teamWidth": 54.8
        },
        "buildUpMid": {
          "lineHeight": 43.8,
          "teamLength": 30.6,
          "teamWidth": 57.4
        },
        "finalThirdPhase": {
          "lineHeight": 57.6,
          "teamLength": 32.6,
          "teamWidth": 47.0
        }
      },
      "outOfPossession": {
        "highBlockPress": {
          "lineHeight": 49.6,
          "teamLength": 36.6,
          "teamWidth": 41.6
        },
        "lowBlock": {
          "lineHeight": 18.2,
          "teamLength": 26.8,
          "teamWidth": 35.8
        },
        "midBlock": {
          "lineHeight": 38.0,
          "teamLength": 29.4,
          "teamWidth": 40.4
        }
      }
    }
  },
  "teamCode": "por",
  "teamId": "portugal"
}
