{
  "formationUsage": [
    {
      "formation": "4-2-3-1",
      "matches": 6,
      "share": 100.0
    }
  ],
  "group": "c",
  "matches": [
    {
      "date": "2026-06-13",
      "distanceCovered": 114.9,
      "expectedGoals": 1.33,
      "formation": "4-2-3-1",
      "goalsAgainst": 1,
      "goalsFor": 1,
      "isHome": false,
      "matchId": "m007-brazil-morocco",
      "opponent": {
        "id": "brazil",
        "name": "Brazil"
      },
      "passCompletion": 86.0,
      "possession": 45.2,
      "result": "draw",
      "shots": 14,
      "shotsOnTarget": 3,
      "stage": "group"
    },
    {
      "date": "2026-06-19",
      "distanceCovered": 115.4,
      "expectedGoals": 0.8,
      "formation": "4-2-3-1",
      "goalsAgainst": 0,
      "goalsFor": 1,
      "isHome": false,
      "matchId": "m030-scotland-morocco",
      "opponent": {
        "id": "scotland",
        "name": "Scotland"
      },
      "passCompletion": 91.0,
      "possession": 54.8,
      "result": "win",
      "shots": 12,
      "shotsOnTarget": 2,
      "stage": "group"
    },
    {
      "date": "2026-06-24",
      "distanceCovered": 111.2,
      "expectedGoals": 2.12,
      "formation": "4-2-3-1",
      "goalsAgainst": 2,
      "goalsFor": 4,
      "isHome": true,
      "matchId": "m050-morocco-haiti",
      "opponent": {
        "id": "haiti",
        "name": "Haiti"
      },
      "passCompletion": 89.0,
      "possession": 60.1,
      "result": "win",
      "shots": 22,
      "shotsOnTarget": 11,
      "stage": "group"
    },
    {
      "date": "2026-06-29",
      "distanceCovered": 139.5,
      "expectedGoals": 1.3,
      "formation": "4-2-3-1",
      "goalsAgainst": 1,
      "goalsFor": 1,
      "isHome": false,
      "matchId": "m075-netherlands-morocco",
      "opponent": {
        "id": "netherlands",
        "name": "Netherlands"
      },
      "passCompletion": 91.0,
      "possession": 61.4,
      "result": "draw",
      "shots": 11,
      "shotsOnTarget": 5,
      "stage": "r32"
    },
    {
      "date": "2026-07-04",
      "distanceCovered": 108.8,
      "expectedGoals": 0.85,
      "formation": "4-2-3-1",
      "goalsAgainst": 0,
      "goalsFor": 3,
      "isHome": false,
      "matchId": "m090-canada-morocco",
      "opponent": {
        "id": "canada",
        "name": "Canada"
      },
      "passCompletion": 84.0,
      "possession": 50.7,
      "result": "win",
      "shots": 5,
      "shotsOnTarget": 4,
      "stage": "r16"
    },
    {
      "date": "2026-07-09",
      "distanceCovered": 108.3,
      "expectedGoals": 0.16,
      "formation": "4-2-3-1",
      "goalsAgainst": 2,
      "goalsFor": 0,
      "isHome": false,
      "matchId": "m097-france-morocco",
      "opponent": {
        "id": "france",
        "name": "France"
      },
      "passCompletion": 87.0,
      "possession": 46.6,
      "result": "loss",
      "shots": 5,
      "shotsOnTarget": 1,
      "stage": "qf"
    }
  ],
  "name": "Morocco",
  "record": {
    "drawn": 2,
    "furthestStage": "qf",
    "goalDifference": 4,
    "goalsAgainst": 6,
    "goalsFor": 10,
    "lost": 1,
    "played": 6,
    "points": 7,
    "won": 3
  },
  "schemaVersion": 4,
  "tacticalIdentity": {
    "defensiveBlockDistribution": {
      "high": 3.5,
      "low": 18.0,
      "mid": 23.8
    },
    "phasesInPossession": {
      "attackingTransition": 11.7,
      "buildUpOpposed": 15.7,
      "buildUpUnopposed": 41.3,
      "counterAttack": 1.5,
      "finalThird": 12.5,
      "longBall": 3.0,
      "progression": 14.7,
      "setPiece": 5.8
    },
    "phasesOutOfPossession": {
      "counterPress": 11.7,
      "defensiveTransition": 16.5,
      "highBlock": 3.5,
      "highPress": 5.7,
      "lowBlock": 18.0,
      "lowPress": 0.8,
      "midBlock": 23.8,
      "midPress": 4.5,
      "recovery": 5.2
    },
    "possession": 53.1,
    "pressingIntensity": 239.3,
    "shapeByPhase": {
      "inPossession": {
        "buildUpLow": {
          "lineHeight": 20.0,
          "teamLength": 36.3,
          "teamWidth": 55.5
        },
        "buildUpMid": {
          "lineHeight": 40.5,
          "teamLength": 31.3,
          "teamWidth": 56.5
        },
        "finalThirdPhase": {
          "lineHeight": 54.8,
          "teamLength": 35.8,
          "teamWidth": 42.8
        }
      },
      "outOfPossession": {
        "highBlockPress": {
          "lineHeight": 47.3,
          "teamLength": 37.0,
          "teamWidth": 40.2
        },
        "lowBlock": {
          "lineHeight": 18.2,
          "teamLength": 20.0,
          "teamWidth": 38.0
        },
        "midBlock": {
          "lineHeight": 36.7,
          "teamLength": 24.8,
          "teamWidth": 40.7
        }
      }
    }
  },
  "teamCode": "mar",
  "teamId": "morocco"
}
