{
  "formationUsage": [
    {
      "formation": "4-4-2",
      "matches": 2,
      "share": 66.7
    },
    {
      "formation": "4-2-3-1",
      "matches": 1,
      "share": 33.3
    }
  ],
  "group": "i",
  "matches": [
    {
      "date": "2026-06-16",
      "distanceCovered": 111.7,
      "expectedGoals": 1.2,
      "formation": "4-4-2",
      "goalsAgainst": 4,
      "goalsFor": 1,
      "isHome": true,
      "matchId": "m018-iraq-norway",
      "opponent": {
        "id": "norway",
        "name": "Norway"
      },
      "passCompletion": 82.0,
      "possession": 34.7,
      "result": "loss",
      "shots": 11,
      "shotsOnTarget": 1,
      "stage": "group"
    },
    {
      "date": "2026-06-22",
      "distanceCovered": 112.1,
      "expectedGoals": 0.7,
      "formation": "4-2-3-1",
      "goalsAgainst": 3,
      "goalsFor": 0,
      "isHome": false,
      "matchId": "m042-france-iraq",
      "opponent": {
        "id": "france",
        "name": "France"
      },
      "passCompletion": 86.0,
      "possession": 44.3,
      "result": "loss",
      "shots": 4,
      "shotsOnTarget": 0,
      "stage": "group"
    },
    {
      "date": "2026-06-26",
      "distanceCovered": 104.7,
      "expectedGoals": 0.21,
      "formation": "4-4-2",
      "goalsAgainst": 5,
      "goalsFor": 0,
      "isHome": false,
      "matchId": "m062-senegal-iraq",
      "opponent": {
        "id": "senegal",
        "name": "Senegal"
      },
      "passCompletion": 71.0,
      "possession": 30.7,
      "result": "loss",
      "shots": 6,
      "shotsOnTarget": 1,
      "stage": "group"
    }
  ],
  "name": "Iraq",
  "record": {
    "drawn": 0,
    "furthestStage": "group",
    "goalDifference": -11,
    "goalsAgainst": 12,
    "goalsFor": 1,
    "lost": 3,
    "played": 3,
    "points": 0,
    "won": 0
  },
  "schemaVersion": 4,
  "tacticalIdentity": {
    "defensiveBlockDistribution": {
      "high": 3.7,
      "low": 34.3,
      "mid": 24.0
    },
    "phasesInPossession": {
      "attackingTransition": 18.3,
      "buildUpOpposed": 14.3,
      "buildUpUnopposed": 32.0,
      "counterAttack": 1.3,
      "finalThird": 8.0,
      "longBall": 7.3,
      "progression": 12.7,
      "setPiece": 7.3
    },
    "phasesOutOfPossession": {
      "counterPress": 7.7,
      "defensiveTransition": 9.7,
      "highBlock": 3.7,
      "highPress": 2.7,
      "lowBlock": 34.3,
      "lowPress": 0.7,
      "midBlock": 24.0,
      "midPress": 3.3,
      "recovery": 4.3
    },
    "possession": 36.6,
    "pressingIntensity": 283.7,
    "shapeByPhase": {
      "inPossession": {
        "buildUpLow": {
          "lineHeight": 16.7,
          "teamLength": 39.3,
          "teamWidth": 54.7
        },
        "buildUpMid": {
          "lineHeight": 36.3,
          "teamLength": 35.0,
          "teamWidth": 54.7
        },
        "finalThirdPhase": {
          "lineHeight": 51.3,
          "teamLength": 39.3,
          "teamWidth": 42.0
        }
      },
      "outOfPossession": {
        "highBlockPress": {
          "lineHeight": 47.0,
          "teamLength": 36.0,
          "teamWidth": 39.7
        },
        "lowBlock": {
          "lineHeight": 17.3,
          "teamLength": 17.0,
          "teamWidth": 34.0
        },
        "midBlock": {
          "lineHeight": 36.3,
          "teamLength": 23.7,
          "teamWidth": 38.3
        }
      }
    }
  },
  "teamCode": "irq",
  "teamId": "iraq"
}
