{
  "formationUsage": [
    {
      "formation": "4-2-3-1",
      "matches": 7,
      "share": 87.5
    },
    {
      "formation": "4-1-2-3",
      "matches": 1,
      "share": 12.5
    }
  ],
  "group": "l",
  "matches": [
    {
      "date": "2026-06-17",
      "distanceCovered": 117.0,
      "expectedGoals": 3.33,
      "formation": "4-2-3-1",
      "goalsAgainst": 2,
      "goalsFor": 4,
      "isHome": true,
      "matchId": "m022-england-croatia",
      "opponent": {
        "id": "croatia",
        "name": "Croatia"
      },
      "passCompletion": 87.0,
      "possession": 49.0,
      "result": "win",
      "shots": 22,
      "shotsOnTarget": 11,
      "stage": "group"
    },
    {
      "date": "2026-06-23",
      "distanceCovered": 108.3,
      "expectedGoals": 1.78,
      "formation": "4-2-3-1",
      "goalsAgainst": 0,
      "goalsFor": 0,
      "isHome": true,
      "matchId": "m045-england-ghana",
      "opponent": {
        "id": "ghana",
        "name": "Ghana"
      },
      "passCompletion": 93.0,
      "possession": 72.4,
      "result": "draw",
      "shots": 19,
      "shotsOnTarget": 3,
      "stage": "group"
    },
    {
      "date": "2026-06-27",
      "distanceCovered": 115.2,
      "expectedGoals": 1.61,
      "formation": "4-2-3-1",
      "goalsAgainst": 0,
      "goalsFor": 2,
      "isHome": false,
      "matchId": "m067-panama-england",
      "opponent": {
        "id": "panama",
        "name": "Panama"
      },
      "passCompletion": 89.0,
      "possession": 57.7,
      "result": "win",
      "shots": 17,
      "shotsOnTarget": 6,
      "stage": "group"
    },
    {
      "date": "2026-07-01",
      "distanceCovered": 115.5,
      "expectedGoals": 1.75,
      "formation": "4-2-3-1",
      "goalsAgainst": 1,
      "goalsFor": 2,
      "isHome": true,
      "matchId": "m080-england-congo-dr",
      "opponent": {
        "id": "congo-dr",
        "name": "Congo DR"
      },
      "passCompletion": 92.0,
      "possession": 53.5,
      "result": "win",
      "shots": 16,
      "shotsOnTarget": 7,
      "stage": "r32"
    },
    {
      "date": "2026-07-05",
      "distanceCovered": 106.7,
      "expectedGoals": 2.12,
      "formation": "4-2-3-1",
      "goalsAgainst": 2,
      "goalsFor": 3,
      "isHome": false,
      "matchId": "m092-mexico-england",
      "opponent": {
        "id": "mexico",
        "name": "Mexico"
      },
      "passCompletion": 80.0,
      "possession": 31.5,
      "result": "win",
      "shots": 6,
      "shotsOnTarget": 5,
      "stage": "r16"
    },
    {
      "date": "2026-07-11",
      "distanceCovered": 140.8,
      "expectedGoals": 1.64,
      "formation": "4-2-3-1",
      "goalsAgainst": 1,
      "goalsFor": 2,
      "isHome": false,
      "matchId": "m099-norway-england",
      "opponent": {
        "id": "norway",
        "name": "Norway"
      },
      "passCompletion": 91.0,
      "possession": 47.4,
      "result": "win",
      "shots": 14,
      "shotsOnTarget": 7,
      "stage": "qf"
    },
    {
      "date": "2026-07-15",
      "distanceCovered": 107.7,
      "expectedGoals": 0.46,
      "formation": "4-2-3-1",
      "goalsAgainst": 2,
      "goalsFor": 1,
      "isHome": true,
      "matchId": "m102-england-argentina",
      "opponent": {
        "id": "argentina",
        "name": "Argentina"
      },
      "passCompletion": 83.0,
      "possession": 35.2,
      "result": "loss",
      "shots": 5,
      "shotsOnTarget": 2,
      "stage": "sf"
    },
    {
      "date": "2026-07-18",
      "distanceCovered": 107.7,
      "expectedGoals": 2.34,
      "formation": "4-1-2-3",
      "goalsAgainst": 4,
      "goalsFor": 6,
      "isHome": false,
      "matchId": "m103-france-england",
      "opponent": {
        "id": "france",
        "name": "France"
      },
      "passCompletion": 90.0,
      "possession": 52.0,
      "result": "win",
      "shots": 19,
      "shotsOnTarget": 11,
      "stage": "third-place"
    }
  ],
  "name": "England",
  "record": {
    "drawn": 1,
    "furthestStage": "third-place",
    "goalDifference": 8,
    "goalsAgainst": 12,
    "goalsFor": 20,
    "lost": 1,
    "played": 8,
    "points": 7,
    "won": 6
  },
  "schemaVersion": 4,
  "tacticalIdentity": {
    "defensiveBlockDistribution": {
      "high": 5.0,
      "low": 25.0,
      "mid": 16.1
    },
    "phasesInPossession": {
      "attackingTransition": 11.9,
      "buildUpOpposed": 14.8,
      "buildUpUnopposed": 37.5,
      "counterAttack": 1.2,
      "finalThird": 17.0,
      "longBall": 4.0,
      "progression": 18.5,
      "setPiece": 5.8
    },
    "phasesOutOfPossession": {
      "counterPress": 10.4,
      "defensiveTransition": 14.6,
      "highBlock": 5.0,
      "highPress": 7.5,
      "lowBlock": 25.0,
      "lowPress": 0.4,
      "midBlock": 16.1,
      "midPress": 3.5,
      "recovery": 5.6
    },
    "possession": 49.8,
    "pressingIntensity": 241.4,
    "shapeByPhase": {
      "inPossession": {
        "buildUpLow": {
          "lineHeight": 18.6,
          "teamLength": 37.9,
          "teamWidth": 53.5
        },
        "buildUpMid": {
          "lineHeight": 44.6,
          "teamLength": 29.0,
          "teamWidth": 55.9
        },
        "finalThirdPhase": {
          "lineHeight": 58.0,
          "teamLength": 33.0,
          "teamWidth": 43.9
        }
      },
      "outOfPossession": {
        "highBlockPress": {
          "lineHeight": 49.5,
          "teamLength": 36.1,
          "teamWidth": 40.2
        },
        "lowBlock": {
          "lineHeight": 17.2,
          "teamLength": 18.2,
          "teamWidth": 34.9
        },
        "midBlock": {
          "lineHeight": 38.9,
          "teamLength": 25.5,
          "teamWidth": 39.8
        }
      }
    }
  },
  "teamCode": "eng",
  "teamId": "england"
}
